quotes,trader
"As much time as I've put in, there's always someone doing more. That, someone, was Qullamaggie - We were both in Stockbee while trying to figure it out. I worked hard but his work ethic was insane. I've done really well - he's become a legend",Scot1andT on twitter
Big money is made in a good few month swing trading environment. Patience is the name of the game,Qullamaggie
"Best stocks surf moving averages, get tight, and then breakout. Best ones show relative strength and cant go lower even if indexes go lower",Qullamaggie
"No substitute for going in depth and studying traders, setups, and markets",Qullamaggie
The biggest drawdowns always happen after big runs. If you dont have a drawdown that means you aren't taking any risk and not making any money.,Qullamaggie
If a stock gaps up with massive volume and breaks the opening range highs you better pay attention,Qullamaggie
Markets only trend 1/3 of the time,Qullamaggie
Need to get feelings out of your trading so you dont randomly sell things,Qullamaggie
If you sell stuff too early in a hot market then you retire 10 years later,Qullamaggie
Spot opportunity when the market is having a down day. Market tells you what stocks wants to go up and they will yell at you. You have to listen to the market,Qullamaggie
An edge is being able to shut off when market is closed and be complete focused when the market is open,Qullamaggie
Its the same cycle over and over again. Same patterns over again just different players but the game doesn't change,Qullamaggie
Never just sell everything into strength. Better to sell 10% to late than to early,Qullamaggie
Recent IPO breakouts can be very powerful. Usually low float and very exciting business,Qullamaggie
Momentum cycles. First leader. Secondary leaders. Third leaders. And then the shittiest stocks of all start ripping,Qullamaggie
"Always need to buy something that has a reason to go up. Sector, theme, earnings, Eps",Qullamaggie
Breakout edge never goes out of favor but you need a good market that is trending,Qullamaggie
Open mind is important and go to where the money is going. Always be flexible,Qullamaggie
Way easier to make money on the long side. No reason to be a short seller. Markets are driven by momentum. Shorting and researching shorts is such a waste of time,Qullamaggie
Biggest problem people make is they think too much. Solid plan and setups and think less. Will be way more profitable,Qullamaggie
All about small losses and big wins. Dont get into the cult of being profitable everyday. Need some home run trades and small losses,Qullamaggie
"Institutions are like elephant in bathtub, they can't hide their activity.",William O'Neil
"When the market bottoms and leaders start emerging, you stop looking at the indexes and you focus on individual stock setups. The market will appear overbought and fool the amateurs that wait for a correction that never comes until the golden opportunity has passed.",Mark Minervini
"It is a video game, no but really you realize after a while it is just a video game. It's all about knowing the game mechanics...if you master game mechanics, you'll be very good at that game. Same thing with the stock market, it's just the same thing over and over again. Don't listen to the idiots on TV or on media that says 'oh this is unprecedented', whatever blah blah yadda yadda, it's not, it's always the same things happening over and over again. It's up to you either be a victim, be an unknowing victim, or choose to be a victim, or you can be in control, it's your choice...",Qullamaggie
I made up my mind to buy high and sell higher.,Nicolas Darvas
